{
  "schemaVersion": 1,
  "recordPurpose": "Phase1Observation",
  "targetId": "BW-HRS-DEV-LAB-EXAMPLE-001",
  "deploymentClass": "OwnerDesignatedDisposableLiveInstall",
  "gameRootCanonical": "C:\\Games\\7DaysToDieLive",
  "buildStageRootCanonical": "D:\\BitWreckedDisposable\\HRS_Phase1_BuildStage",
  "saveRootCanonical": "C:\\Users\\Example\\AppData\\Roaming\\7DaysToDie\\Saves",
  "worldName": "Navezgane",
  "gameName": "HRS_Phase1_Test_001",
  "worldGuid": null,
  "executionType": "LocalSinglePlayer",
  "eacState": "Disabled",
  "expectedFingerprint": {
    "gameDisplayVersion": "V 3.1.0 (b14)",
    "steamBuildId": "24436778",
    "unityVersion": "2022.3.62f2",
    "assemblyCSharpSha256": "B13862E30D8B28F42B83FE6A36BF074D155A6C43164E7B0797A6E4F77BD7DEA3",
    "assemblyCSharpMvid": "acb580d9-e1ab-497d-a8dc-47e47c1fc300"
  },
  "backup": {
    "backupRootCanonical": "D:\\BitWreckedDisposable\\HRS_Phase1_Backup",
    "manifestSha256": "BBBBBBBBBBBBBBBBBBBBBBBBBBBBBBBBBBBBBBBBBBBBBBBBBBBBBBBBBBBBBBBB",
    "createdUtc": "2026-08-14T12:00:00Z",
    "recoverable": true
  },
  "ownerApproval": {
    "approvedForPrivateObservationLab": true,
    "approvalScope": "Phase1ObservationPrivateLab",
    "approvedUtc": "2026-08-14T12:00:00Z",
    "ownedModFolderName": "BitWrecked_HistoricalRandomStart_DEV",
    "externalBuildStageRequired": true,
    "newGameOnly": true,
    "protectExistingSavesAndWorlds": true,
    "protectExistingMods": true,
    "protectProjectWorkspace": true,
    "wipeRequiresSeparateApproval": true,
    "copyAndLoadRequireExactArtifactApproval": true
  },
  "createdUtc": "2026-08-14T12:00:00Z",
  "expiresUtc": "2026-09-14T12:00:00Z"
}
