{
  "schemaVersion": 1,
  "recordPurpose": "Phase1Observation",
  "targetId": "BW-HRS-DEV-LAB-001",
  "deploymentClass": "OwnerDesignatedDisposableLiveInstall",
  "gameRootCanonical": "C:\\Program Files (x86)\\Steam\\steamapps\\common\\7 Days To Die",
  "buildStageRootCanonical": "C:\\BitWreckedDisposable\\HRS_Phase1\\BuildStage",
  "saveRootCanonical": "C:\\Users\\mobil\\AppData\\Roaming\\7DaysToDie\\Saves",
  "worldName": "Navezgane",
  "gameName": "HRS_Phase1_Test_001",
  "worldGuid": null,
  "executionType": "LocalSinglePlayer",
  "eacState": "Disabled",
  "expectedFingerprint": {
    "gameDisplayVersion": "V 3.1.0 (b14)",
    "steamBuildId": "24436778",
    "unityVersion": "2022.3.62f2",
    "assemblyCSharpSha256": "B13862E30D8B28F42B83FE6A36BF074D155A6C43164E7B0797A6E4F77BD7DEA3",
    "assemblyCSharpMvid": "acb580d9-e1ab-497d-a8dc-47e47c1fc300"
  },
  "backup": {
    "backupRootCanonical": "C:\\BitWreckedDisposable\\HRS_Phase1\\Backup",
    "manifestSha256": "8532E676455D025F338D03C267A92F7D54FA413288EBC0039DA41341B471C4C0",
    "createdUtc": "2026-08-20T23:49:50Z",
    "recoverable": true
  },
  "ownerApproval": {
    "approvedForPrivateObservationLab": true,
    "approvalScope": "Phase1ObservationPrivateLab",
    "approvedUtc": "2026-08-20T23:49:50Z",
    "ownedModFolderName": "BitWrecked_HistoricalRandomStart_DEV",
    "externalBuildStageRequired": true,
    "newGameOnly": true,
    "protectExistingSavesAndWorlds": true,
    "protectExistingMods": true,
    "protectProjectWorkspace": true,
    "wipeRequiresSeparateApproval": true,
    "copyAndLoadRequireExactArtifactApproval": true
  },
  "createdUtc": "2026-08-20T23:49:50Z",
  "expiresUtc": "2026-09-20T23:49:50Z"
}
